TX.VAL.MRCH.CD.WT,CC BY-4.0,Merchandise exports (current US$),,Merchandise exports show the f.o.b. value of goods provided to the rest of the world valued in current U.S. dollars.,World Trade Organization.,Private Sector & Trade: Exports,Annual,,Gap-filled total,"Merchandise trade data are from customs reports of goods moving into or out of an economy or from reports of financial transactions related to merchandise trade recorded in the balance of payments. Because of differences in timing and definitions, trade flow estimates from customs reports and balance of payments may differ. Several international agencies process trade data, each correcting unreported or misreported data, leading to other differences.

The data on total exports of goods (merchandise) are from the World Trade Organization (WTO), which obtains data from national statistical offices and the IMF's International Financial Statistics, supplemented by the Comtrade database and publications or databases of regional organizations, specialized agencies, economic groups, and private sources (such as Eurostat, the Food and Agriculture Organization, and country reports of the Economist Intelligence Unit). Country websites and email contact have improved collection of up-to-date statistics, reducing the proportion of estimates. The WTO database now covers most major traders in Africa, Asia, and Latin America, which together with high-income countries account for nearly 95 percent of world trade. Reliability of data for countries in Europe and Central Asia has also improved.",,"Exports are recorded as the cost of the goods delivered to the frontier of the exporting country for shipment - the free on board (f.o.b.) value.

Countries may report trade according to the general or special system of trade. Under the general system exports comprise outward-moving goods that are (a) goods wholly or partly produced in the country; (b) foreign goods, neither transformed nor declared for domestic consumption in the country, that move outward from customs storage; and (c) goods previously included as imports for domestic consumption but subsequently exported without transformation. Under the special system exports comprise categories a and c. In some compilations categories b and c are classified as re-exports. Because of differences in reporting practices, data on exports may not be fully comparable across economies.

Data on exports of goods are derived from the same sources as data on imports. In principle, world exports and imports should be identical. Similarly, exports from an economy should equal the sum of imports by the rest of the world from that economy. But differences in timing and definitions result in discrepancies in reported values at all levels.",,,https://datacatalog.worldbank.org/public-licenses#cc-by
NE.EXP.GNFS.ZS,CC BY-4.0,Exports of goods and services (% of GDP),,"Exports of goods and services represent the value of all goods and other market services provided to the rest of the world. They include the value of merchandise, freight, insurance, transport, travel, royalties, license fees, and other services, such as communication, construction, financial, information, business, personal, and government services. They exclude compensation of employees and investment income (formerly called factor services) and transfer payments.","World Bank national accounts data, and OECD National Accounts data files.",Economic Policy & Debt: National accounts: Shares of GDP & other,Annual,,Weighted average,"Gross domestic product (GDP) from the expenditure side is made up of household final consumption expenditure, general government final consumption expenditure, gross capital formation (private and public investment in fixed assets, changes in inventories, and net acquisitions of valuables), and net exports (exports minus imports) of goods and services. Such expenditures are recorded in purchaser prices and include net taxes on products.",,"Because policymakers have tended to focus on fostering the growth of output, and because data on production are easier to collect than data on spending, many countries generate their primary estimate of GDP using the production approach. Moreover, many countries do not estimate all the components of national expenditures but instead derive some of the main aggregates indirectly using GDP (based on the production approach) as the control total.

Data on exports and imports are compiled from customs reports and balance of payments data. Although the data from the payments side provide reasonably reliable records of cross-border transactions, they may not adhere strictly to the appropriate definitions of valuation and timing used in the balance of payments or corresponds to the change-of ownership criterion. This issue has assumed greater significance with the increasing globalization of international business. Neither customs nor balance of payments data usually capture the illegal transactions that occur in many countries. Goods carried by travelers across borders in legal but unreported shuttle trade may further distort trade statistics.",,,https://datacatalog.worldbank.org/public-licenses#cc-by
NE.EXP.GNFS.KD.ZG,CC BY-4.0,Exports of goods and services (annual % growth),,"Annual growth rate of exports of goods and services based on constant local currency. Aggregates are based on constant 2015 prices, expressed in U.S. dollars. Exports of goods and services represent the value of all goods and other market services provided to the rest of the world. They include the value of merchandise, freight, insurance, transport, travel, royalties, license fees, and other services, such as communication, construction, financial, information, business, personal, and government services. They exclude compensation of employees and investment income (formerly called factor services) and transfer payments.","World Bank national accounts data, and OECD National Accounts data files.",Economic Policy & Debt: National accounts: Growth rates,Annual,,Weighted average,,,,,,https://datacatalog.worldbank.org/public-licenses#cc-by
NE.EXP.GNFS.KD,CC BY-4.0,Exports of goods and services (constant 2015 US$),,"Exports of goods and services represent the value of all goods and other market services provided to the rest of the world. They include the value of merchandise, freight, insurance, transport, travel, royalties, license fees, and other services, such as communication, construction, financial, information, business, personal, and government services. They exclude compensation of employees and investment income (formerly called factor services) and transfer payments. Data are in constant 2015 prices, expressed in U.S. dollars.","World Bank national accounts data, and OECD National Accounts data files.",Economic Policy & Debt: National accounts: US$ at constant 2015 prices: Expenditure on GDP,Annual,2015,Gap-filled total,"Gross domestic product (GDP) from the expenditure side is made up of household final consumption expenditure, general government final consumption expenditure, gross capital formation (private and public investment in fixed assets, changes in inventories, and net acquisitions of valuables), and net exports (exports minus imports) of goods and services. Such expenditures are recorded in purchaser prices and include net taxes on products.","An economy's growth is measured by the change in the volume of its output or in the real incomes of its residents. The 2008 United Nations System of National Accounts (2008 SNA) offers three plausible indicators for calculating growth: the volume of gross domestic product (GDP), real gross domestic income, and real gross national income. The volume of GDP is the sum of value added, measured at constant prices, by households, government, and industries operating in the economy. GDP accounts for all domestic production, regardless of whether the income accrues to domestic or foreign institutions.","Because policymakers have tended to focus on fostering the growth of output, and because data on production are easier to collect than data on spending, many countries generate their primary estimate of GDP using the production approach. Moreover, many countries do not estimate all the components of national expenditures but instead derive some of the main aggregates indirectly using GDP (based on the production approach) as the control total.

Data on exports and imports are compiled from customs reports and balance of payments data. Although the data from the payments side provide reasonably reliable records of cross-border transactions, they may not adhere strictly to the appropriate definitions of valuation and timing used in the balance of payments or corresponds to the change-of ownership criterion. This issue has assumed greater significance with the increasing globalization of international business. Neither customs nor balance of payments data usually capture the illegal transactions that occur in many countries. Goods carried by travelers across borders in legal but unreported shuttle trade may further distort trade statistics.",,,https://datacatalog.worldbank.org/public-licenses#cc-by
EN.POP.SLUM.UR.ZS,CC BY-4.0,Population living in slums (% of urban population),,"Population living in slums is the proportion of the urban population living in slum households. A slum household is defined as a group of individuals living under the same roof lacking one or more of the following conditions: access to improved water, access to improved sanitation, sufficient living area, housing durability, and security of tenure, as adopted in the Millennium Development Goal Target 7.D. The successor, the Sustainable Development Goal 11.1.1, considers inadequate housing (housing affordability) to complement the above definition of slums/informal settlements.",United Nations Human Settlements Programme (UN-HABITAT),Environment: Density & urbanization,Annual,,Weighted average,,,,,,https://datacatalog.worldbank.org/public-licenses#cc-by
EN.POP.EL5M.ZS,CC BY-4.0,Population living in areas where elevation is below 5 meters (% of total population),,Population below 5m is the percentage of the total population living in areas where the elevation is 5 meters or less.,"Center for International Earth Science Information Network (CIESIN)/Columbia University. 2013. Urban-Rural Population and Land Area Estimates Version 2. Palisades, NY: NASA Socioeconomic Data and Applications Center (SEDAC). http://sedac.ciesin.columbia.edu/data/set/lecz-urban-rural-population-land-area-estimates-v2.",Environment: Land use,Annual,,Weighted average,Population counts in low elevation zones in the year 1990 as described by GRUMPv1 input estimates allocated into 3 arc second grid cells. Population counts in low elevation zones in the year 2000 as described by GRUMPv1 input estimates allocated into 3 arc second grid cells. Population counts in low elevation zones in the year 2010 derived from the application of United Nations 2000-2010 national growth rates to year 2000 population data from GRUMPv1 (see documentation for full description of methodologies).,"Scientists use the terms climate change and global warming to refer to the gradual increase in the Earth's surface temperature that has accelerated since the industrial revolution and especially over the past two decades. Most global warming has been caused by human activities that have changed the chemical composition of the atmosphere through a buildup of greenhouse gases - primarily carbon dioxide, methane, and nitrous oxide. Rising global temperatures will cause sea level rise and alter local climate conditions, affecting forests, crop yields, and water supplies, and may affect human health, animals, and many types of ecosystems.","The 2007 Intergovernmental Panel on Climate Change's (IPCC) assessment report concluded that global warming is “unequivocal” and gave the strongest warning yet about the role of human activities. The report estimated that sea levels would rise approximately 49 centimeters over the next 100 years, with a range of uncertainty of 20–86 centimeters. That will lead to increased coastal flooding through direct inundation and a higher base for storm surges, allowing flooding of larger areas and higher elevations. Climate model simulations predict an increase in average surface air temperature of about 2.5°C by 2100 (Kattenberg and others 1996) and increase of “killer” heat waves during the warm season (Karl and others 1997).",,,https://datacatalog.worldbank.org/public-licenses#cc-by
SP.POP.GROW,CC BY-4.0,Population growth (annual %),"Annual population growth rate. Population is based on the de facto definition of population, which counts all residents regardless of legal status or citizenship.","Annual population growth rate for year t is the exponential rate of growth of midyear population from year t-1 to t, expressed as a percentage . Population is based on the de facto definition of population, which counts all residents regardless of legal status or citizenship.","Derived from total population. Population source: (1) United Nations Population Division. World Population Prospects: 2019 Revision, (2) Census reports and other statistical publications from national statistical offices, (3) Eurostat: Demographic Statistics, (4) United Nations Statistical Division. Population and Vital Statistics Reprot (various years), (5) U.S. Census Bureau: International Database, and (6) Secretariat of the Pacific Community: Statistics and Demography Programme.",Health: Population: Dynamics,Annual,,Weighted average,"Total population growth rates are calculated on the assumption that rate of growth is constant between two points in time. The growth rate is computed using the exponential growth formula:

r = ln(pn/p0)/n, 

where r is the exponential rate of growth, ln() is the natural logarithm, pn is the end period population, p0 is the beginning period population, and n is the number of years in between. Note that this is not the geometric growth rate used to compute compound growth over discrete periods.

For information on total population from which the growth rates are calculated, see total population (SP.POP.TOTL).",,,,,https://datacatalog.worldbank.org/public-licenses#cc-by
EN.POP.DNST,CC BY-4.0,Population density (people per sq. km of land area),,"Population density is midyear population divided by land area in square kilometers. Population is based on the de facto definition of population, which counts all residents regardless of legal status or citizenship--except for refugees not permanently settled in the country of asylum, who are generally considered part of the population of their country of origin. Land area is a country's total area, excluding area under inland water bodies, national claims to continental shelf, and exclusive economic zones. In most cases the definition of inland water bodies includes major rivers and lakes.",Food and Agriculture Organization and World Bank population estimates.,Environment: Density & urbanization,Annual,,Weighted average,"Population density is midyear population divided by land area in square kilometers. This ratio can be calculated for any territorial unit for any point in time, depending on the source of the population data. Populationestimates are prepared by World Bank staff from variety of sources. They are based on the de facto definition of population and include all residents regardless of legal status or citizenship, within the physical boundaries of a country and under the jurisdiction of that country's political control. Refugees not permanently settled in the country of asylum are considered part of the population of their country of origin. Population numbers are either current census data or historical census data extrapolated through demographic methods. The count also excludes visitors from overseas.

Population density is calculated by dividing midyear population by land area in a country. Population is based on the de facto definition of population, which counts all residents regardless of legal status or citizenship - except for refugees not permanently settled in the country of asylum, who are generally considered part of the population of their country of origin. Land area is a country's total area, excluding area under inland water bodies, national claims to continental shelf, and exclusive economic zones. In most cases the definition of inland water bodies includes major rivers and lakes.","Population estimates are usually based on national population censuses. Estimates for the years before and after the census are interpolations or extrapolations based on demographic models. Errors and undercounting occur even in high-income countries; in developing countries errors may be substantial because of limits in the transport, communications, and other resources required conducting and analyzing a full census.

Population density is a measure of the intensity of land-use, and can be calculated for a block, city, county, state, country, continent or the entire world. Considering that over half of the Earth's land mass consists of areas inhospitable to human inhabitation, such as deserts and high mountains, and that population tends to cluster around seaports and fresh water sources, a simple number of population density by itself does not give any meaningful measurement of human population density.

Several of the most densely populated territories in the world are city-states, microstates, or dependencies.[6][7] These territories share a relatively small area and a high urbanization level, with an economically specialized city population drawing also on rural resources outside the area, illustrating the difference between high population density and overpopulation.","Current population estimates for developing countries that lack recent census data and pre- and post-census estimates for countries with census data are provided by the United Nations Population Division and other agencies. The cohort component method - a standard method for estimating and projecting population - requires fertility, mortality, and net migration data, often collected from sample surveys, which can be small or limited in coverage. Population estimates are from demographic modeling and so are susceptible to biases and errors from shortcomings in the model and in the data. Because the five-year age group is the cohort unit and five-year period data are used, interpolations to obtain annual data or single age structure may not reflect actual events or age composition.

The quality and reliability of official demographic data are also affected by public trust in the government, government commitment to full and accurate enumeration, confidentiality and protection against misuse of census data, and census agencies' independence from political influence. Moreover, comparability of population indicators is limited by differences in the concepts, definitions, collection procedures, and estimation methods used by national statistical agencies and other organizations that collect the data.",,,https://datacatalog.worldbank.org/public-licenses#cc-by
AG.LND.AGRI.ZS,CC BY-4.0,Agricultural land (% of land area),,"Agricultural land refers to the share of land area that is arable, under permanent crops, and under permanent pastures. Arable land includes land defined by the FAO as land under temporary crops (double-cropped areas are counted once), temporary meadows for mowing or for pasture, land under market or kitchen gardens, and land temporarily fallow. Land abandoned as a result of shifting cultivation is excluded. Land under permanent crops is land cultivated with crops that occupy the land for long periods and need not be replanted after each harvest, such as cocoa, coffee, and rubber. This category includes land under flowering shrubs, fruit trees, nut trees, and vines, but excludes land under trees grown for wood or timber. Permanent pasture is land used for five or more years for forage, including natural and cultivated crops.","Food and Agriculture Organization, electronic files and web site.",Environment: Land use,Annual,,Weighted average,"Agriculture is still a major sector in many economies, and agricultural activities provide developing countries with food and revenue. But agricultural activities also can degrade natural resources. Poor farming practices can cause soil erosion and loss of soil fertility. Efforts to increase productivity by using chemical fertilizers, pesticides, and intensive irrigation have environmental costs and health impacts. Excessive use of chemical fertilizers can alter the chemistry of soil. Pesticide poisoning is common in developing countries. And salinization of irrigated land diminishes soil fertility. Thus, inappropriate use of inputs for agricultural production has far-reaching effects.

Agricultural land is also sometimes classified as irrigated and non-irrigated land. In arid and semi-arid countries agriculture is often confined to irrigated land, with very little farming possible in non-irrigated areas. Land abandoned as a result of shifting cultivation is excluded from Arable land.

Data on agricultural land are valuable for conducting studies on a various perspectives concerning agricultural production, food security and for deriving cropping intensity among others uses. Agricultural land indicator, along with land-use indicators, can also elucidate the environmental sustainability of countries' agricultural practices.

Total land area does not include inland water bodies such as major rivers and lakes. Variations from year to year may be due to updated or revised data rather than to change in area.","Agricultural land covers more than one-third of the world's land area, with arable land representing less than one-third of agricultural land (about 10 percent of the world's land area). Agricultural land constitutes only a part of any country's total area, which can include areas not suitable for agriculture, such as forests, mountains, and inland water bodies.

In many industrialized countries, agricultural land is subject to zoning regulations. In the context of zoning, agricultural land (or more properly agriculturally zoned land) refers to plots that may be used for agricultural activities, regardless of the physical type or quality of land.

FAO's agricultural land data contains a wide range of information on variables that are significant for: understanding the structure of a country's agricultural sector; making economic plans and policies for food security; deriving environmental indicators, including those related to investment in agriculture and data on gross crop area and net crop area which are useful for policy formulation and monitoring.

There is no single correct mix of inputs to the agricultural land, as it is dependent on local climate, land quality, and economic development; appropriate levels and application rates vary by country and over time and depend on the type of crops, the climate and soils, and the production process used.","The data are collected by the Food and Agriculture Organization of the United Nations (FAO) from official national sources through annual questionnaires and are supplemented with information from official secondary data sources. The secondary sources cover official country data from websites of national ministries, national publications and related country data reported by various international organizations.. The FAO tries to impose standard definitions and reporting methods, but complete consistency across countries and over time is not possible. Thus, data on agricultural land in different climates may not be comparable. For example, permanent pastures are quite different in nature and intensity in African countries and dry Middle Eastern countries. Data on agricultural employment, in particular, should be used with caution. In many countries much agricultural employment is informal and unrecorded, including substantial work performed by women and children. To address some of these concerns, this indicator is heavily footnoted in the database in sources, definition, and coverage.",,,https://datacatalog.worldbank.org/public-licenses#cc-by
