Code,License Type,Indicator Name,Short definition,Long definition,Source,Topic,Periodicity,Base Period,Aggregation method,Statistical concept and methodology,Development relevance,Limitations and exceptions,General comments,Notes from original source,License URL
NY.GNP.PCAP.KD,CC BY-4.0,GNI per capita (constant 2015 US$),,GNI per capita is gross national income divided by midyear population. GNI (formerly GNP) is the sum of value added by all resident producers plus any product taxes (less subsidies) not included in the valuation of output plus net receipts of primary income (compensation of employees and property income) from abroad. Data are in constant 2015 U.S. dollars.,"World Bank national accounts data, and OECD National Accounts data files.",Economic Policy & Debt: National accounts: US$ at constant 2015 prices: Aggregate indicators,Annual,2015,Weighted average,,,,,,https://datacatalog.worldbank.org/public-licenses#cc-by
NY.GNP.PCAP.CN,CC BY-4.0,GNI per capita (current LCU),,GNI per capita is gross national income divided by midyear population. GNI (formerly GNP) is the sum of value added by all resident producers plus any product taxes (less subsidies) not included in the valuation of output plus net receipts of primary income (compensation of employees and property income) from abroad. Data are in current local currency.,"World Bank national accounts data, and OECD National Accounts data files.",Economic Policy & Debt: National accounts: Local currency at current prices: Aggregate indicators,Annual,,,,,,,,https://datacatalog.worldbank.org/public-licenses#cc-by
SH.STA.MMRT,CC BY-4.0,"Maternal mortality ratio (modeled estimate, per 100,000 live births)",,"Maternal mortality ratio is the number of women who die from pregnancy-related causes while pregnant or within 42 days of pregnancy termination per 100,000 live births. The data are estimated with a regression model using information on the proportion of maternal deaths among non-AIDS deaths in women ages 15-49, fertility, birth attendants, and GDP measured using purchasing power parities (PPPs).","WHO, UNICEF, UNFPA, World Bank Group, and the United Nations Population Division. Trends in Maternal Mortality: 2000 to 2017. Geneva, World Health Organization, 2019",Health: Reproductive health,Annual,,Weighted average,"Reproductive health is a state of physical and mental well-being in relation to the reproductive system and its functions and processes. Means of achieving reproductive health include education and services during pregnancy and childbirth, safe and effective contraception, and prevention and treatment of sexually transmitted diseases. Complications of pregnancy and childbirth are the leading cause of death and disability among women of reproductive age in developing countries.

Maternal mortality is generally of unknown reliability, as are many other cause-specific mortality indicators. Household surveys such as Demographic and Health Surveys attempt to measure maternal mortality by asking respondents about survivorship of sisters. The main disadvantage of this method is that the estimates of maternal mortality that it produces pertain to any time within the past few years before the survey, making them unsuitable for monitoring recent changes or observing the impact of interventions. In addition, measurement of maternal mortality is subject to many types of errors. Even in high-income countries with reliable vital registration systems, misclassification of maternal deaths has been found to lead to serious underestimation.

The estimates are based on an exercise by the Maternal Mortality Estimation Inter-Agency Group (MMEIG) which consists of World Health Organization (WHO), United Nations Children's Fund (UNICEF), World Bank, and United Nations Population Fund (UNFPA), and include country-level time series data. For countries without complete registration data but with other types of data and for countries with no data, maternal mortality is estimated with a regression model using available national maternal mortality data and socioeconomic information.",,"The methodology differs from that used for previous estimates, so data should not be compared historically. Maternal mortality ratios are generally of unknown reliability, as are many other cause-specific mortality indicators. The ratios cannot be assumed to provide an exact estimate of maternal mortality.",This indicator represents the risk associated with each pregnancy and is also a Sustainable Development Goal Indicator (3.1.1) for monitoring maternal health.,"Estimates of maternal mortality are presented along with upper and lower  limits of intervals (see footnote) designed to depict the uncertainty of estimates. The intervals are the product of a detailed probabilistic evaluation of the uncertainty attributable to the various components of the estimation process. For estimates derived from the multilevel regression model, the components of uncertainty were divided into two groups: those reflected within the regression model (internal sources), and those due to assumptions or calculations that occur outside the model (external sources). Estimates of the total uncertainty reflect a combination of these various sources.",https://datacatalog.worldbank.org/public-licenses#cc-by
SH.STA.MMRT.NE,CC BY-4.0,"Maternal mortality ratio (national estimate, per 100,000 live births)",,"Maternal mortality ratio is the number of women who die from pregnancy-related causes while pregnant or within 42 days of pregnancy termination per 100,000 live births.","The country data compiled, adjusted and used in the estimation model by the Maternal Mortality Estimation Inter-Agency Group (MMEIG). The country data were compiled from the following sources:  civil registration and vital statistics; specialized studies on maternal mortality; population based surveys and censuses; other available data sources including data from surveillance sites.",Health: Reproductive health,Annual,,,"Reproductive health is a state of physical and mental well-being in relation to the reproductive system and its functions and processes. Means of achieving reproductive health include education and services during pregnancy and childbirth, safe and effective contraception, and prevention and treatment of sexually transmitted diseases. Complications of pregnancy and childbirth are the leading cause of death and disability among women of reproductive age in developing countries.

Maternal mortality ratios are generally of unknown reliability, as are many other cause-specific mortality indicators. Household surveys such as Demographic and Health Surveys attempt to measure maternal mortality by asking respondents about survivorship of sisters. The main disadvantage of this method is that the estimates of maternal mortality that it produces pertain to any time within the past few years before the survey, making them unsuitable for monitoring recent changes or observing the impact of interventions. In addition, measurement of maternal mortality is subject to many types of errors. Even in high-income countries with reliable vital registration systems, misclassification of maternal deaths has been found to lead to serious underestimation.

The national estimates of maternal mortality ratios are based on national surveys, vital registration records, and surveillance data or are derived from community and hospital records.",,"Maternal mortality ratios are generally of unknown reliability, as are many other cause-specific mortality indicators. The ratios cannot be assumed to provide an exact estimate of maternal mortality. Some of the figures shown were adjusted by the Maternal Mortality Estimation Inter-Agency Group (MMEIG) to enhance reliability, so that they may differ from the published figures from sources such as household surveys.",,,https://datacatalog.worldbank.org/public-licenses#cc-by
SH.DYN.MORT,CC BY-4.0,"Mortality rate, under-5 (per 1,000 live births)",,"Under-five mortality rate is the probability per 1,000 that a newborn baby will die before reaching age five, if subject to age-specific mortality rates of the specified year.","Estimates developed by the UN Inter-agency Group for Child Mortality Estimation (UNICEF, WHO, World Bank, UN DESA Population Division) at www.childmortality.org.",Health: Mortality,Annual,,Weighted average,"The main sources of mortality data are vital registration systems and direct or indirect estimates based on sample surveys or censuses. A "complete" vital registration system - covering at least 90 percent of vital events in the population - is the best source of age-specific mortality data.

Estimates of neonatal, infant, and child mortality tend to vary by source and method for a given time and place. Years for available estimates also vary by country, making comparisons across countries and over time difficult. To make neonatal, infant, and child mortality estimates comparable and to ensure consistency across estimates by different agencies, the United Nations Inter-agency Group for Child Mortality Estimation (UN IGME), which comprises the United Nations Children's Fund (UNICEF), the World Health Organization (WHO), the World Bank, the United Nations Population Division, and other universities and research institutes, developed and adopted a statistical method that uses all available information to reconcile differences. The method uses statistical models to obtain a best estimate trend line by fitting a country-specific regression model of mortality rates against their reference dates.","Mortality rates for different age groups (infants, children, and adults) and overall mortality indicators (life expectancy at birth or survival to a given age) are important indicators of health status in a country. Because data on the incidence and prevalence of diseases are frequently unavailable, mortality rates are often used to identify vulnerable populations. And they are among the indicators most frequently used to compare socioeconomic development across countries.","Complete vital registration systems are fairly uncommon in developing countries. Thus estimates must be obtained from sample surveys or derived by applying indirect estimation techniques to registration, census, or survey data. Survey data are subject to recall error, and surveys estimating infant/child deaths require large samples because households in which a birth has occurred during a given year cannot ordinarily be preselected for sampling. Indirect estimates rely on model life tables that may be inappropriate for the population concerned. Extrapolations based on outdated surveys may not be reliable for monitoring changes in health status or for comparative analytical work.","Given that data on the incidence and prevalence of diseases are frequently unavailable, mortality rates are often used to identify vulnerable populations. Moreover, they are among the indicators most frequently used to compare socioeconomic development across countries. Under-five mortality rates are higher for boys than for girls in countries in which parental gender preferences are insignificant. Under-five mortality captures the effect of gender discrimination better than infant mortality does, as malnutrition and medical interventions have more significant impacts to this age group. Where female under-five mortality is higher, girls are likely to have less access to resources than boys.

Aggregate data for LIC, UMC, LMC, HIC are computed based on the groupings for the World Bank fiscal year in which the data was released by the UN Inter-agency Group for Child Mortality Estimation.

This is the Sustainable Development Goal indicator 3.2.1[https://unstats.un.org/sdgs/metadata/].",,https://datacatalog.worldbank.org/public-licenses#cc-by
SH.STA.STNT.ZS,CC BY-4.0,"Prevalence of stunting, height for age (% of children under 5)",,Prevalence of stunting is the percentage of children under age 5 whose height for age is more than two standard deviations below the median for the international reference population ages 0-59 months. For children up to two years old height is measured by recumbent length. For older children height is measured by stature while standing. The data are based on the WHO's new child growth standards released in 2006.,"UNICEF, WHO, World Bank: Joint child malnutrition estimates (JME). Aggregation is based on UNICEF, WHO, and the World Bank harmonized dataset (adjusted, comparable data) and methodology.",Health: Nutrition,Annual,,See SH.STA.STNT.ME.ZS for aggregation,,,,"Undernourished children have lower resistance to infection and are more likely to die from common childhood ailments such as diarrheal diseases and respiratory infections. Frequent illness saps the nutritional status of those who survive, locking them into a vicious cycle of recurring sickness and faltering growth (UNICEF, www.childinfo.org). Estimates are from national survey data. Being even mildly underweight increases the risk of death and inhibits cognitive development in children. And it perpetuates the problem across generations, as malnourished women are more likely to have low-birth-weight babies. Stunting, or being below median height for age, is often used as a proxy for multifaceted deprivation and as an indicator of long-term changes in malnutrition.",,https://datacatalog.worldbank.org/public-licenses#cc-by
SE.SEC.ENRR,CC BY-4.0,"School enrollment, secondary (% gross)",,"Gross enrollment ratio is the ratio of total enrollment, regardless of age, to the population of the age group that officially corresponds to the level of education shown. Secondary education completes the provision of basic education that began at the primary level, and aims at laying the foundations for lifelong learning and human development, by offering more subject- or skill-oriented instruction using more specialized teachers.",UNESCO Institute for Statistics (http://uis.unesco.org/). Data as of September 2021.,Education: Participation,Annual,,Weighted average,"Gross enrollment ratio for secondary school is calculated by dividing the number of students enrolled in secondary education regardless of age by the population of the age group which officially corresponds to secondary education, and multiplying by 100. 

Data on education are collected by the UNESCO Institute for Statistics from official responses to its annual education survey. All the data are mapped to the International Standard Classification of Education (ISCED) to ensure the comparability of education programs at the international level. The current version was formally adopted by UNESCO Member States in 2011. Population data are drawn from the United Nations Population Division. Using a single source for population data standardizes definitions, estimations, and interpolation methods, ensuring a consistent methodology across countries and minimizing potential enumeration problems in national censuses.

The reference years reflect the school year for which the data are presented. In some countries the school year spans two calendar years (for example, from September 2010 to June 2011); in these cases the reference year refers to the year in which the school year ended (2011 in the example).","Gross enrollment ratios indicate the capacity of each level of the education system, but a high ratio may reflect a substantial number of overage children enrolled in each grade because of repetition or late entry rather than a successful education system. The net enrollment rate excludes overage and underage students and more accurately captures the system's coverage and internal efficiency. Differences between the gross enrollment ratio and the net enrollment rate show the incidence of overage and underage enrollments.","Enrollment indicators are based on annual school surveys, but do not necessarily reflect actual attendance or dropout rates during the year. Also, the length of education differs across countries and can influence enrollment rates, although the International Standard Classification of Education (ISCED) tries to minimize the difference. For example, a shorter duration for primary education tends to increase the rate; a longer one to decrease it (in part because older children are more at risk of dropping out). Moreover, age at enrollment may be inaccurately estimated or misstated, especially in communities where registration of births is not strictly enforced.","For aggregate data, each economy is classified based on the classification of World Bank Group's fiscal year 2021 (July 1, 2020-June 30, 2021).",,https://datacatalog.worldbank.org/public-licenses#cc-by
SE.ADT.LITR.ZS,CC BY-4.0,"Literacy rate, adult total (% of people ages 15 and above)",,Adult literacy rate is the percentage of people ages 15 and above who can both read and write with understanding a short simple statement about their everyday life.,UNESCO Institute for Statistics (http://uis.unesco.org/). Data as of September 2021.,Education: Outcomes,Annual,,Weighted average,"Literacy statistics for most countries cover the population ages 15 and older, but some include younger ages or are confined to age ranges that tend to inflate literacy rates. The youth literacy rate for ages 15-24 reflects recent progress in education. It measures the accumulated outcomes of primary education over the previous 10 years or so by indicating the proportion of the population who have passed through the primary education system and acquired basic literacy and numeracy skills. Generally, literacy also encompasses numeracy, the ability to make simple arithmetic calculations.

Data on literacy are compiled by the UNESCO Institute for Statistics based on national censuses and household surveys and, for countries without recent literacy data, using the Global Age-Specific Literacy Projection Model (GALP). For detailed information, see www.uis.unesco.org.","Literacy rate is an outcome indicator to evaluate educational attainment. This data can predict the quality of future labor force and can be used in ensuring policies for life skills for men and women.

It can be also used as a proxy instrument to see the effectiveness of education system; a high literacy rate suggests the capacity of an education system to provide a large population with opportunities to acquire literacy skills. The accumulated achievement of education is fundamental for further intellectual growth and social and economic development, although it doesn't necessarily ensure the quality of education.

Literate women implies that they can seek and use information for the betterment of the health, nutrition and education of their household members. Literate women are also empowered to play a meaningful role.","In practice, literacy is difficult to measure. Estimating literacy rates requires census or survey measurements under controlled conditions. Many countries report the number of literate people from self-reported data. Some use educational attainment data as a proxy but apply different lengths of school attendance or levels of completion. Ant there is a trend among recent national and international surveys toward using a direct reading test of literacy skills. Because definitions and methods of data collection differ across countries, data should be used cautiously.","For aggregate data, each economy is classified based on the classification of World Bank Group's fiscal year 2021 (July 1, 2020-June 30, 2021).",,https://datacatalog.worldbank.org/public-licenses#cc-by
SE.ENR.SECO.FM.ZS,CC BY-4.0,"School enrollment, secondary (gross), gender parity index (GPI)",,Gender parity index for gross enrollment ratio in secondary education is the ratio of girls to boys enrolled at secondary level in public and private schools.,UNESCO Institute for Statistics (http://uis.unesco.org/). Data as of September 2021.,Education: Participation,Annual,,Weighted average,"This indicator is calculated by dividing female gross enrollment ratio in secondary education by male gross enrollment ratio in secondary education. 

Data on education are collected by the UNESCO Institute for Statistics from official responses to its annual education survey. All the data are mapped to the International Standard Classification of Education (ISCED) to ensure the comparability of education programs at the international level. The current version was formally adopted by UNESCO Member States in 2011. 

The reference years reflect the school year for which the data are presented. In some countries the school year spans two calendar years (for example, from September 2010 to June 2011); in these cases the reference year refers to the year in which the school year ended (2011 in the example).",The Gender Parity Index (GPI) indicates parity between girls and boys. A GPI of less than 1 suggests girls are more disadvantaged than boys in learning opportunities and a GPI of greater than 1 suggests the other way around. Eliminating gender disparities in education would help increase the status and capabilities of women.,,"For aggregate data, each economy is classified based on the classification of World Bank Group's fiscal year 2021 (July 1, 2020-June 30, 2021).",,https://datacatalog.worldbank.org/public-licenses#cc-by
NV.AGR.TOTL.ZS,CC BY-4.0,"Agriculture, forestry, and fishing, value added (% of GDP)",,"Agriculture, forestry, and fishing corresponds to ISIC divisions 1-3 and includes forestry, hunting, and fishing, as well as cultivation of crops and livestock production. Value added is the net output of a sector after adding up all outputs and subtracting intermediate inputs. It is calculated without making deductions for depreciation of fabricated assets or depletion and degradation of natural resources. The origin of value added is determined by the International Standard Industrial Classification (ISIC), revision 4. Note: For VAB countries, gross value added at factor cost is used as the denominator.","World Bank national accounts data, and OECD National Accounts data files.",Economic Policy & Debt: National accounts: Shares of GDP & other,Annual,,Weighted average,"Gross domestic product (GDP) represents the sum of value added by all its producers. Value added is the value of the gross output of producers less the value of intermediate goods and services consumed in production, before accounting for consumption of fixed capital in production. The United Nations System of National Accounts calls for value added to be valued at either basic prices (excluding net taxes on products) or producer prices (including net taxes on products paid by producers but excluding sales or value added taxes). Both valuations exclude transport charges that are invoiced separately by producers. Total GDP is measured at purchaser prices. Value added by industry is normally measured at basic prices.",,"Among the difficulties faced by compilers of national accounts is the extent of unreported economic activity in the informal or secondary economy. In developing countries a large share of agricultural output is either not exchanged (because it is consumed within the household) or not exchanged for money. Agricultural production often must be estimated indirectly, using a combination of methods involving estimates of inputs, yields, and area under cultivation. This approach sometimes leads to crude approximations that can differ from the true values over time and across crops for reasons other than climate conditions or farming techniques. Similarly, agricultural inputs that cannot easily be allocated to specific outputs are frequently "netted out" using equally crude and ad hoc approximations.","Note: Data for OECD countries are based on ISIC, revision 4.",,https://datacatalog.worldbank.org/public-licenses#cc-by
